{
  "schema_version": 2,
  "reservation_id": "38573641207-1-audit-export",
  "reservation_sha256": "c2a9ab1f73ee35ac2b7ff92a269ce2ed938307dfa52bf991b2882616449ea3b8",
  "utc_date": "2026-10-14",
  "planned_month": "2026-10",
  "workflow": "Audit TMDB Export Coverage",
  "run_id": "38573641207",
  "run_attempt": "1",
  "job": "audit-catalogues",
  "allocation_key": "audit_export",
  "request_class": "audit-export",
  "target_dimension": "all",
  "allowance": 14,
  "attempts_used": 2,
  "unused_allowance": 12,
  "first_attempt_at": "2026-10-14T13:40:10.876Z",
  "last_attempt_at": "2026-10-14T13:40:11.622Z",
  "by_host": {
    "api.themoviedb.org": 0,
    "files.tmdb.org": 2
  },
  "by_status_or_outcome": {
    "200": 2
  },
  "retries": 0,
  "datasets": [
    "companies",
    "networks"
  ],
  "targets": {
    "companies": "sha256:5cb086e4b1aaf2d0920083ee60cb9c10fba4995e53dfc911e45d5856e6cf3384",
    "networks": "sha256:d73807c98d166761de115983f3cea840d3615a9c047df441adf22b3e5b539401"
  }
}
