{
  "schema_version": 2,
  "reservation_id": "30810486433-1-audit-export",
  "reservation_sha256": "f7e8d61180463ce98079befb9f09e0e0f8295e8383a72d411a7dc78097f01afc",
  "utc_date": "2026-08-03",
  "planned_month": "2026-08",
  "workflow": "Audit TMDB Export Coverage",
  "run_id": "30810486433",
  "run_attempt": "1",
  "job": "audit-and-initialize-targets",
  "allocation_key": "audit_export",
  "request_class": "audit-export",
  "target_dimension": "all",
  "allowance": 14,
  "attempts_used": 2,
  "unused_allowance": 12,
  "first_attempt_at": "2026-08-03T11:41:22.682Z",
  "last_attempt_at": "2026-08-03T11:41:23.686Z",
  "by_host": {
    "api.themoviedb.org": 0,
    "files.tmdb.org": 2
  },
  "by_status_or_outcome": {
    "200": 2
  },
  "retries": 0,
  "datasets": [
    "companies",
    "networks"
  ],
  "targets": {
    "companies": "sha256:105c614933dac2e238e4865ede1d94ccbdd41b52bb1b71aa5ad233f8aa3c2965",
    "networks": "sha256:5f3071f12998820bbf14541c9240e0d36207d455c31d4129644cef454e4cbb5b"
  }
}
